"0","reticulate::repl_python()"
"2","Python 3.9.6 (C:/Users/pedro/anaconda3_02/envs/bootcampfinal/python.exe)
Reticulate 1.20 REPL -- A Python interpreter in R.
"
"0","import pandas as pd"
"0","import seaborn as sns"
"0","from scipy.stats import normaltest"
"0","import matplotlib.pyplot as plt"
"0","import warnings"
"0","import os"
"0",""
"0","from sklearn.dummy import DummyClassifier"
"0","from sklearn.linear_model import LogisticRegression"
"0","from sklearn.tree import DecisionTreeClassifier"
"0","from sklearn.ensemble import RandomForestClassifier,ExtraTreesClassifier"
"0","from lightgbm import LGBMClassifier"
"0","from xgboost import XGBClassifier"
"0",""
"0","from sklearn.utils import resample"
"0","from sklearn.feature_selection import SelectFromModel"
"0","from sklearn.model_selection import RepeatedStratifiedKFold, RandomizedSearchCV"
"0","from sklearn.pipeline import Pipeline"
"0","from pipelinehelper import PipelineHelper"
"0","from joblib import dump"
"0","import pickle"
